year,term,college,subject,subject_name,number,name,description,credit_hours,gen_ed,gen_ed_name,crn,section,section_info,section_notes,section_attributes,section_capp_area,section_co_request,section_special_approval,part_of_term,start_date,end_date,meeting,type,type_name,start_time,end_time,days,room,building,instructor
2018,Winter,KT,MACS,Media and Cinema Studies,356,Sex & Gender in Popular Media,"Examines the notion that the mass media influence our development as gendered individuals, looking at those who argue for and against this notion. Considers different forms of feminist theory applied to the study of mass media, the history and scholarly criticisms of the media and their portrayal of women, and feminist attempts to create alternatives to mainstream media images. Throughout, the course considers representation of minorities in the dominant media and examines newly created alternative representations. Same as GWS 356.",3 hours.,1WCC,Cultural Studies - Western,10011,A  ,,,Cultural Studies - Western course.,,,,1,2017-12-22Z,2018-01-13Z,0,ONL,Online,ARRANGED,,,,,"Grosse, M"
2018,Winter,KR,MUS,Music,130,Introd to the Art of Music,"Provides non-music majors with basic listening skills, the ability to discuss music intelligently, and an acquaintance with many types of music. Prerequisite: For non-music majors only.",3 hours.,1WCC,Cultural Studies - Western,10031,A  ,"Provides non-music majors with basic listening skills, the ability to discuss music intelligently, and an acquaintance with many types of music. NOTE:  This course will be run completely online through Compass.   **More sections may be added depending on demand for this course.",,"Humanities - Lit & Arts, and Cultural Studies - Western course.",,,,1,2017-12-22Z,2018-01-13Z,0,ONL,Online,ARRANGED,,,,,"Magee, G"
2018,Winter,KR,MUS,Music,130,Introd to the Art of Music,"Provides non-music majors with basic listening skills, the ability to discuss music intelligently, and an acquaintance with many types of music. Prerequisite: For non-music majors only.",3 hours.,1LA,Humanities – Lit & Arts,10031,A  ,"Provides non-music majors with basic listening skills, the ability to discuss music intelligently, and an acquaintance with many types of music. NOTE:  This course will be run completely online through Compass.   **More sections may be added depending on demand for this course.",,"Humanities - Lit & Arts, and Cultural Studies - Western course.",,,,1,2017-12-22Z,2018-01-13Z,0,ONL,Online,ARRANGED,,,,,"Magee, G"
2018,Winter,KV,PHIL,Philosophy,102,Logic and Reasoning,"Practical study of logical reasoning; techniques for analyzing and criticizing arguments, with emphasis on assessing the logical coherence of what we read and write.",3 hours.,1HP,Humanities – Hist & Phil,10046,DG ,,,Humanities - Hist & Phil course.,,,,1,2017-12-22Z,2018-01-13Z,0,ONL,Online,ARRANGED,,,,,"Gilbert, D"
2018,Winter,KV,PS,Political Science,224,Politics of the National Parks,"Examines the politics of national parks in the United States, including creation of parks, local support or opposition to parks, and park policy as well as policy questions such as the value of wilderness ecosystem management, endangered species protection, and role of parks in national identity and remembrance of events such as the Civil War, the Indian wars, or the civil rights movement. Same as RST 224. Additional fees may apply. See Class Schedule. May be repeated in separate terms to a maximum of 10 hours.",2 OR 3 hours.,1SS,Social & Beh Sci - Soc Sci,10029,A  ,,,Social & Beh Sci - Soc Sci course.,,,,1,2017-12-22Z,2018-01-13Z,0,ONL,Online,ARRANGED,,,,,"Paschall, C"
2018,Winter,KV,PSYC,Psychology,100,Intro Psych,"Study of human behavior with special reference to perception, learning, memory, thinking, emotional life, and individual differences in intelligence, aptitude, and personality; emphasis on the scientific nature of psychological investigations; and discussion of research methods and the relation of their results to daily life and everyday problems. Lectures, discussions, and six hours of participation as a subject in psychological experiments. Credit is not given for both PSYC 100 and either PSYC 103 or PSYC 105.",4 hours.,1BSC,Social & Beh Sci - Beh Sci,10034,A  ,,,Social & Beh Sci - Beh Sci course.,,,,1,2017-12-22Z,2018-01-13Z,0,ONL,Online,ARRANGED,,,,,"Shenouda, C"
2018,Winter,KY,RST,"Recreation, Sport, and Tourism",100,RST in Modern Society,"Central issues in defining leisure; historical, philosophical, sociological, psychological, and economic approaches to understanding leisure behavior, its meanings, social contexts, and personal and social resources.",3 hours.,1SS,Social & Beh Sci - Soc Sci,10041,ONL,,,Social & Beh Sci - Soc Sci course.,,,,1,2017-12-22Z,2018-01-13Z,0,ONL,Online,ARRANGED,,,,,"Shinew, K"
2018,Winter,KV,SOC,Sociology,100,Introduction to Sociology,"Examination of how societies grow and change; reciprocal effects of economic, political, community, familial, and scientific institutions on each other and on individual life changes; and social conflict, problems of bureaucratic growth and planned and unplanned social change.",4 hours.,1SS,Social & Beh Sci - Soc Sci,10018,ONL,"Seats will be opened up gradually during early registration to allow opportunity for all level of students.  Students should periodically check the Course Explorer or Student Self-Service for open seats.  More detailed information about this course is available at: faculty.las.illinois.edu/djs (follow the link)  The Winter Term is very compressed: Students are expected to do four months of work in just one month. You should only take this course if you can devote four times as much time to this class every day as you would spend on an average day in a sixteen-week semester course. There are holidays during the Winter Term (Christmas Day and New Year's Day), but otherwise expect to spend some time online every day of Winter Term, and to be working every day (reading, thinking, &tc.) offline as well.  http://courses.atlas.illinois.edu/winter2017-2018/SOC/SOC100ONL/",,Social & Beh Sci - Soc Sci course.,,,,1,2017-12-22Z,2018-01-13Z,0,ONL,Online,ARRANGED,,,,,"Steward, D"
2018,Winter,KV,SOC,Sociology,101,Sociology of Gender,"An exploration of current questions of gender and their applications to students today. The course will focus primarily on the United States emphasizing individual, interactional, and institutional aspects of the social world. Topics for study include sociological research on femininities, masculinities, gendered bodies, socialization, work, family, politics, sport, and sexualities.",3 hours.,1SS,Social & Beh Sci - Soc Sci,10048,01 ,,,Social & Beh Sci - Soc Sci course.,,,,1,2017-12-22Z,2018-01-13Z,0,ONL,Online,ARRANGED,,,,,"Krueger, J"
2018,Winter,KV,SOC,Sociology,130,Intro Gender & Women's Studies,Same as GWS 100 and HDFS 140. See GWS 100.,3 hours.,1SS,Social & Beh Sci - Soc Sci,10044,AA ,Meet w/GWS 100 (CRN 10042) and HDFS 140 (CRN 10043),,Social & Beh Sci - Soc Sci course.,,,,1,2017-12-22Z,2018-01-13Z,0,ONL,Online,ARRANGED,,,,,"Cole, C"
2018,Winter,KV,SPAN,Spanish,130,Intermediate Spanish,"Continued development of reading, writing and conversational skills. This is considered a third level course for purposes of fulfilling the University General Education Language requirement. Credit is not given for both SPAN 130 and SPAN 103. Prerequisite: SPAN 122 or equivalent placement score.",4 hours.,,Social & Beh Sci - Soc Sci,10039,A  ,"""This course requires several videochat sessions in small groups arranged according to students' schedules.""",,,,,,1,2017-12-22Z,2018-01-13Z,0,ONL,Online,ARRANGED,,,,,"Gonzalez Boluda, M"
2018,Winter,KV,SPAN,Spanish,142,Spanish in the Professions,"Introduction to Spanish in business, law, medical, education & social service fields, with a focus on the importance of bilingualism in the U.S., strategies for lifelong learning, and culture considerations. The development of functional use of Spanish within the professional context is the major focus of the course. This is considered a fourth level course for purposes of fulfilling the University General Education Language requirement. Credit is not given for both SPAN 141 and SPAN 142. Prerequisite: SPAN 130 (formerly numbered 103), equivalent course, or placement score.",4 hours.,,Social & Beh Sci - Soc Sci,10040,A  ,"""This course requires several videochat sessions in small groups arranged according to students' schedules.""",,,,,,1,2017-12-22Z,2018-01-13Z,0,ONL,Online,ARRANGED,,,,,"Henshaw, F"
